{
  "schema_version": "1.0",
  "bundle_id": "fantasy-resonance-care-1",
  "created_at": "2026-10-10T03:00:00Z",
  "domain_id": "fantasy-world-a",
  "semantic_snapshot": {
    "sha256": "sha256:d0218a6d5ea5b4b9ea2570e89554cea9d9a361a9d44a0de41480c9d8087506a8",
    "locator": "fixtures/semantic-snapshot.json",
    "media_type": "application/json",
    "display_version": "fixture-1"
  },
  "capabilities": [
    {
      "sha256": "sha256:51e7cb41169ce4178ced0818bc4cabff60a8d509e5599af1f933cb1a9797e239",
      "locator": "fixture:resonance-care-capability",
      "media_type": "application/octet-stream",
      "display_version": "fixture-1"
    }
  ],
  "source_provenance": [
    {
      "sha256": "sha256:8045d34430078737a94b03c1e03fd8d5cc26069952c0db61d99a6db029a00966",
      "locator": "fixture:source-commit-descriptor",
      "media_type": "application/octet-stream",
      "display_version": "fixture-1"
    }
  ],
  "tool_definitions": [
    {
      "sha256": "sha256:6dc11e41ac04b0e0ffcf6fbbc551eb5317d808ee516da9a80a86737b76db3b24",
      "locator": "fixture:resonance-tool-schema",
      "media_type": "application/octet-stream",
      "display_version": "fixture-1"
    }
  ],
  "tool_adapters": [
    {
      "sha256": "sha256:33f64d9cda77dbc90079de6e84f757402bb409c9078ded5a2143e7d83f957a96",
      "locator": "fixture:resonance-tool-adapter",
      "media_type": "application/octet-stream",
      "display_version": "fixture-1"
    }
  ],
  "model_specification": {
    "sha256": "sha256:6bd9e4c479f6963f8f9978492a519736ea4f0bba5479fe3390349763c19f2e3d",
    "locator": "fixture:provider-model-specification",
    "media_type": "application/octet-stream",
    "display_version": "fixture-1"
  },
  "model_retention_status": "provider_version_not_guaranteed",
  "instructions": [
    {
      "sha256": "sha256:abed2a3b7eef7f226b0fb3fe155696654f6bcf0dd2f2a5bb28807a96f1e75205",
      "locator": "fixture:instructions",
      "media_type": "application/octet-stream",
      "display_version": "fixture-1"
    }
  ],
  "authority_policy": {
    "sha256": "sha256:7d495191539a30048516e40fcd1973b0b65c76e713fef901e59dfedab8c1a51a",
    "locator": "fixture:resonance-authority-policy",
    "media_type": "application/octet-stream",
    "display_version": "fixture-1"
  },
  "evaluation_suite": {
    "sha256": "sha256:94c6a83159b875a961c5efb1cd1f39808be3ffb3db378330b128ae3d78ca1333",
    "locator": "fixture:evaluation-suite",
    "media_type": "application/octet-stream",
    "display_version": "fixture-1"
  },
  "deployment_configuration": {
    "sha256": "sha256:445f1fe99ac848f8584caf8fca6a9825eb53028f059e80f92fc8e7ac86ff3c1d",
    "locator": "fixture:deployment-config",
    "media_type": "application/octet-stream",
    "display_version": "fixture-1"
  },
  "state_schema": {
    "sha256": "sha256:b043c0999c6832ff47f4f794128010c363d9e4df87e1d43825639ab83a85dd39",
    "locator": "fixture:state-schema-v2",
    "media_type": "application/octet-stream",
    "display_version": "fixture-1"
  },
  "migration_plan": {
    "sha256": "sha256:c37386c2133220a1ddcd893e07822644f5e0ba7bfa027a3d22459a8179cd8022",
    "locator": "fixture:migration-plan",
    "media_type": "application/octet-stream",
    "display_version": "fixture-1"
  },
  "recovery_plan": {
    "sha256": "sha256:ad3bb47288917482468756936e0d171ded01aad6163135d779c079f920ded3b2",
    "locator": "fixture:recovery-plan",
    "media_type": "application/octet-stream",
    "display_version": "fixture-1"
  },
  "knowledge_read_policy": {
    "sha256": "sha256:325f9b0419ff60227bb7dfc958548a29ea1bfc236915d16315ccf9f5591351f5",
    "locator": "fixture:knowledge-freshness-policy",
    "media_type": "application/octet-stream",
    "display_version": "fixture-1"
  },
  "semantic_query_adapter": {
    "sha256": "sha256:dadd3fbc49e00b6a76f89b0f8b957d196cc2a9858cb81db99b505fe5a2e54c5f",
    "locator": "fixture:query-adapter",
    "media_type": "application/octet-stream",
    "display_version": "fixture-1"
  },
  "external_dependencies": [],
  "reconstruction_limitations": [
    "Provider-model weights are not retained; placeholder tool/environment artifacts in fixture."
  ]
}
